{"contract":"usage-max.observation.v1","observationId":"obs-replay-001","provider":"openai","surface":"codex-cli","source":"local-rollout-replayed","account":{"slot":"openai-primary","approved":true},"capturedAt":"2026-10-15T06:01:00Z","providerEventAt":"2026-10-14T04:00:00Z","authority":"provider","state":"quarantined","freshness":"unknown","confidence":"measured","window":{"id":"weekly-20261014","kind":"weekly","resetsAt":"2026-10-19T00:00:00Z","usedPercentage":30},"model":null,"data":{"reason":"provider event is older than the accepted last-good observation"}}
