{"contract":"usage-max.observation.v1","observationId":"obs-chatgpt-001","provider":"openai","surface":"chatgpt","source":"attachment-discovery","account":null,"capturedAt":"2026-10-15T06:00:00Z","providerEventAt":null,"authority":"unattributed","state":"unavailable","freshness":"unknown","confidence":"unknown","window":null,"model":{"raw":null,"canonical":null,"known":false,"family":null,"effort":null},"data":{"reason":"no supported adapter attached"}}
