{"contract":"usage-max.observation.v1","observationId":"obs-fork-001","provider":"openai","surface":"codex-cli","source":"forked-subagent-log","account":{"slot":"openai-primary","approved":true},"capturedAt":"2026-10-15T06:03:00Z","providerEventAt":"2026-10-15T06:03:00Z","authority":"local-activity","state":"quarantined","freshness":"unknown","confidence":"derived","window":null,"model":{"raw":"gpt-6-luna","canonical":"gpt-6-luna","known":true,"family":"luna","effort":"low"},"data":{"reason":"parent-child lineage is incomplete; do not sum until deduplicated"}}
