{"contract":"usage-max.observation.v1","observationId":"obs-claude-001","provider":"anthropic","surface":"claude-code","source":"anthropic-oauth-usage","account":{"slot":"anthropic-primary","approved":true},"capturedAt":"2026-10-15T06:00:00Z","providerEventAt":"2026-10-15T05:59:58Z","authority":"provider","state":"observing","freshness":"fresh","confidence":"measured","window":{"id":"five-hour-20261015-a","kind":"five_hour","resetsAt":"2026-10-15T10:00:00Z","usedPercentage":12},"model":null,"data":{"limitsPresent":true}}
