{"contract":"usage-max.observation.v1","observationId":"obs-reset-001","provider":"openai","surface":"codex-desktop","source":"local-rollout-rate-limits","account":{"slot":"openai-primary","approved":true},"capturedAt":"2026-10-15T06:02:00Z","providerEventAt":"2026-10-15T06:02:00Z","authority":"provider","state":"quarantined","freshness":"unknown","confidence":"measured","window":{"id":"weekly-backward-reset","kind":"weekly","resetsAt":"2026-10-14T00:00:00Z","usedPercentage":4},"model":null,"data":{"reason":"reset timestamp moved backward without a proven reset or account change"}}
