{"contract":"usage-max.observation.v1","observationId":"obs-unknown-001","provider":"openai","surface":"codex-desktop","source":"local-rollout","account":{"slot":"openai-primary","approved":true},"capturedAt":"2026-10-15T06:00:00Z","providerEventAt":null,"authority":"local-activity","state":"observing","freshness":"unknown","confidence":"unknown","window":null,"model":{"raw":"future-model-decorated-id","canonical":null,"known":false,"family":null,"effort":null},"data":{"routingAllowed":false}}
