{"contract":"usage-max.observation.v1","observationId":"obs-codex-001","provider":"openai","surface":"codex-cli","source":"local-rollout-rate-limits","account":{"slot":"openai-primary","approved":true},"capturedAt":"2026-10-15T06:00:00Z","providerEventAt":null,"authority":"local-activity","state":"observing","freshness":"unknown","confidence":"derived","window":{"id":"weekly-local-001","kind":"weekly","resetsAt":"2026-10-19T00:00:00Z","usedPercentage":76},"model":{"raw":"gpt-6.1-sol","canonical":"gpt-6.1-sol","known":true,"family":"sol","effort":"high"},"data":{"fallback":true}}
