{"contract":"usage-max.observation.v1","observationId":"obs-stale-001","provider":"openai","surface":"codex-cli","source":"local-cache","account":{"slot":"openai-primary","approved":true},"capturedAt":"2026-10-14T06:00:00Z","providerEventAt":"2026-10-13T06:00:00Z","authority":"provider","state":"observing","freshness":"stale","confidence":"measured","window":{"id":"weekly-20261013","kind":"weekly","resetsAt":"2026-10-19T00:00:00Z","usedPercentage":71},"model":null,"data":{"routingAllowed":false}}
